mediatype,collection,pid,repository,dates,summary,title
Letters,Felix Agnus papers,umd:59757,Historical Manuscripts,1801-1900;1863-01-24,"Special Order No. 29, by Capt. Felix Agnus, Company ""A"" regarding promotions and assignments, January 24, 1863","Special Order No. 29, Promotions and Appointments in Company ""A,"" 165th New York, January 24, 1863"
Letters,Felix Agnus papers,umd:59760,Historical Manuscripts,1801-1900;1863-09-30,"Abstract of Materials Expended or Consumed by Company ""A,"" 165th New York, 3rd Quarter, circa September 1863.","Abstract of Materials Expended or Consumed by Company ""A,"" 165th New York, 3rd Quarter, September 30, 1863"
Letters,Felix Agnus papers,umd:59765,Historical Manuscripts,1801-1900;1863-08-29,"List of Ordnance received at Baton Rouge, Louisiana, from Major Felix Agnus by Lieutenant E. B. Webster of the 165th New York Regiment, 29 August 1863.","Form No. 7, List of Ordnance Received from Major Felix Agnus by Lieutenant E. B. Webster at Baton Rouge, Louisiana, 29 August 1863"
Letters,Felix Agnus papers,umd:59768,Historical Manuscripts,1801-1900;1866,"Felix Agnus, military service record and assorted documents, including discharge document, 1866","Felix Agnus, military service record and assorted documents, 1866"
Letters,Felix Agnus papers,umd:59770,Historical Manuscripts,1801-1900;1864-10-22,"Letter from unknown officer (James?) to his wife, October 22, 1864.","Letter from unknown officer to his wife, October 22, 1864"
Letters,Felix Agnus papers,umd:59772,Historical Manuscripts,1801-1900;1867-06-12,"Appointment of Felix Agnus as Assistant Assessor for Division No. Eleven, 3rd Collection District, State of Maryland, June 12, 1867","Appointment of Felix Agnus as Assistant Assessor for Division No. Eleven, 3rd Collection District, State of Maryland, June 12, 1867"
Letters,Felix Agnus papers,umd:59773,Historical Manuscripts,1801-1900;1869-05-29,"Letter from Felix Agnus to General Brooks concerning the loan of artillery piece from the 1st Maryland Light Artillery, May 29, 1869","Letter from Felix Agnus to General Brooks concerning the loan of artillery piece from the 1st Maryland Light Artillery, May 29, 1869"
Letters,Felix Agnus papers,umd:59774,Historical Manuscripts,1801-1900;1869-06-24,"Letter from [?], Inspector General, to General Felix Agnus, concerning donations to the Grand Army of the Republic, June 24, 1869","Letter from [?], Inspector General, to General Felix Agnus, concerning donations to the Grand Army of the Republic, June 24, 1869"
